{
  "formatVersion": "1.0.0",
  "packageId": "example.contracts",
  "packageVersion": "2.4.0",
  "sourceCommit": "aaaaaaaaaaaaaaaaaaaaaaaaaaaaaaaaaaaaaaaa",
  "familyFormatVersions": {
    "example.widgets": "1.2.0",
    "example.events": "3.0.1"
  },
  "exports": {
    "example.widget.create": {
      "path": "contracts/example/widgets/create.schema.json",
      "family": "example.widgets",
      "artifactHash": "cccccccccccccccccccccccccccccccccccccccccccccccccccccccccccccccc",
      "documentation": {
        "formatVersion": "1.0.0",
        "itemId": "example.widget.create",
        "documentation": {
          "title": {
            "id": "example.widget.create.title",
            "canonicalEnglish": "Create a widget"
          },
          "description": {
            "id": "example.widget.create.description",
            "canonicalEnglish": "Creates one example widget."
          }
        },
        "examples": [{"name": "sample"}, null, 3],
        "visibility": "public",
        "sourceHash": "bbbbbbbbbbbbbbbbbbbbbbbbbbbbbbbbbbbbbbbbbbbbbbbbbbbbbbbbbbbbbbbb"
      },
      "lifecycle": {
        "formatVersion": "1.0.0",
        "itemId": "example.widget.create",
        "state": "active",
        "since": "1.0.0"
      }
    }
  }
}
